{
  "content_version": "1.0",
  "product_id": "PPL-PELVIC-QUIET-001",
  "source": "factory-generator",
  "generated_at": "2026-08-26T16:08:37.133Z",
  "hero": {
    "headline": "The Quiet Leak",
    "subheadline": "A Private, Evidence-Based Guide to Understanding and Improving Postpartum Bladder Control",
    "body": "Understands it deserves attention, has a safe pelvic-floor progression, knows when to seek professional assessment.",
    "cta_label": "Get the System",
    "trust_line": "Educational content - not medical, clinical, or mental-health advice.",
    "evidence_label": "Educational content informed by practical and lived experience. It is not a substitute for medical, clinical, or mental-health assessment."
  },
  "before_after": {
    "label": "What changes",
    "before_items": [
      "The situation as it stands today."
    ],
    "after_items": [
      "Understands it deserves attention, has a safe pelvic-floor progression, knows when to seek professional assessment."
    ]
  },
  "who_for": {
    "for_label": "This is for you if",
    "for_items": [
      "Anyone in the situation this system is built for: a Private, Evidence-Based Guide to Understanding and Improving Postpartum Bladder Control."
    ],
    "not_for_label": "This is NOT for you if",
    "not_for_items": [
      "If you need clinical diagnosis or treatment, this educational system is not a substitute for professional care."
    ]
  },
  "promise": {
    "label": "What we promise - and what we don't",
    "we_do": "Understands it deserves attention, has a safe pelvic-floor progression, knows when to seek professional assessment.",
    "we_do_not": "We do not promise a guaranteed outcome. This is an educational system, not medical, clinical, or mental-health care.",
    "evidence_label": "Educational content informed by practical and lived experience. It is not a substitute for medical, clinical, or mental-health assessment."
  },
  "final_cta": {
    "headline": "Understands it deserves attention, has a safe pelvic-floor progression, knows when to seek professional assessment.",
    "body": "Understands it deserves attention, has a safe pelvic-floor progression, knows when to seek professional assessment.",
    "cta_label": "Get The Quiet Leak",
    "trust_line": "Educational content - not medical, clinical, or mental-health advice."
  }
}
