{
  "content_version": "1.0",
  "product_id": "PPL-NIGHT-SHIFT-001",
  "source": "factory-generator",
  "generated_at": "2026-09-16T00:00:00Z",
  "page": {
    "composition": "standard"
  },
  "hero": {
    "headline": "Every Night, Just Me",
    "subheadline": "A postpartum night-coordination system that replaces nightly arguing with a pre-agreed roster, a fairness ledger, and the exact words to make it stick.",
    "body": "You are running every night alone while your partner sleeps. Nobody owns the night, so the default becomes you own all of it. This system makes the division explicit: a written roster, three templates, a sleep banker, and the scripts to make it stick.",
    "cta_label": "Get the System",
    "trust_line": "Educational content - not medical, clinical, or mental-health advice. This coordinates night-care between adults; it never diagnoses or treats any condition and never replaces professional care.",
    "evidence_label": "Educational content informed by relationship research, postpartum guidance, and lived experience. It is not a substitute for medical, clinical, or mental-health assessment."
  },
  "before_state": {
    "label": "Before",
    "headline": "The night has no owner",
    "paragraphs": [
      "Doing 100% of nights, every night, for weeks.",
      "'Can you help more?' produced a one-off gesture, not a system.",
      "Rage at his calm breathing while you feed; grief for the relationship."
    ],
    "punch": "This is not a character flaw. It is a system gap - and the roster closes it.",
    "timeline": {
      "label": "Your nights",
      "ticks": [
        {
          "text": "You wake for every feed - alone",
          "alert": true
        },
        {
          "text": "He doesn't know what help looks like"
        },
        {
          "text": "The score is kept in your head",
          "alert": true
        }
      ]
    }
  },
  "modules": {
    "label": "What You Get",
    "headline": "6 components. One written system.",
    "intro": "Work through them in order, or jump straight to what tonight needs.",
    "items": [
      {
        "title": "The Argument That Ends the War",
        "kind": "Guide",
        "description": "Why 'just ask for help' keeps failing, and what replaces it.",
        "icon": "roadmap"
      },
      {
        "title": "Tonight's Shift Chart + Contract Templates",
        "kind": "Do",
        "description": "Three templates (breastfeeding split / formula alternating / no-partner support web) plus the fillable shift chart.",
        "icon": "checklist"
      },
      {
        "title": "Which Night Model Fits Us?",
        "kind": "Decide",
        "description": "A short decision tree that routes you to the right template in minutes.",
        "icon": "route"
      },
      {
        "title": "14-Day Night Tracker",
        "kind": "Track",
        "description": "Log protected blocks, partner initiative and arguments - your own evidence.",
        "icon": "tracker"
      },
      {
        "title": "Seven Script Cards",
        "kind": "Communicate",
        "description": "Ready words for the seven hardest moments - calm, firm, no war.",
        "icon": "scripts"
      },
      {
        "title": "Bad Night Protocol + Safety Gate",
        "kind": "Rescue",
        "description": "What to do when a night collapses - and when exhaustion needs more than a night plan.",
        "icon": "rescue"
      }
    ]
  },
  "before_after": {
    "label": "Before / After",
    "headline": "From she-does-everything to an agreement",
    "intro": "The change is observable, not a feeling.",
    "before_items": [
      "Nights/week with zero protected block: all of them",
      "Arguments about 'whose turn' several times a week",
      "Resentment building in silence"
    ],
    "after_items": [
      "A protected block >=3h on most nights",
      "'Whose turn' arguments <=1x/week",
      "Partner initiates his shift without being reminded"
    ]
  },
  "who_for": {
    "label": "Who it's for",
    "headline": "Built for the mother running every night alone",
    "intro": "Read the not-for list as carefully as the for list.",
    "for_label": "This is for you if",
    "for_items": [
      "You are 0-12 weeks postpartum and doing 100% of nights",
      "Your partner is present but 'helping' means one nappy change",
      "You are breastfeeding and believed you had no choice but to do it all",
      "You have no partner at home and need a support-web roster"
    ],
    "not_for_label": "This is not",
    "not_for_items": [
      "Baby sleep training or a newborn sleep program",
      "A diagnosis or treatment for postpartum depression or any condition",
      "A guarantee that every night will work"
    ],
    "note": "When exhaustion stops being 'tired', this system stops and routes out to professional care."
  },
  "promise": {
    "label": "What we promise - and what we don't",
    "headline": "A written agreement, not a guarantee.",
    "we_do_label": "We promise you",
    "we_do": "A written, fair night-shift system both adults follow, protecting a 4-5 hour sleep opportunity for the mother whenever circumstances allow - without renegotiating it every night.",
    "we_do_not_label": "We do not promise you",
    "we_do_not": "We do not promise sleep (a newborn still wakes), a cure for exhaustion, a mental-health or relationship outcome, or that any single night will go to plan. This is a coordination system, not medical care.",
    "evidence_label": "Educational content informed by relationship research, postpartum guidance, and lived experience. It is not a substitute for medical, clinical, or mental-health assessment."
  },
  "inside": {
    "label": "Inside",
    "headline": "What is in the system",
    "intro": "Six working components, not chapters to read once.",
    "items": [
      "The Argument That Ends the War (short read)",
      "Three contract templates + Tonight's Shift Chart",
      "Which Night Model Fits Us? (decision tree)",
      "14-Day Night Tracker",
      "Seven Script Cards",
      "Bad Night Protocol + safety gate"
    ]
  },
  "final_cta": {
    "eyebrow": "The night needs an owner",
    "headline": "Give the night a roster tonight.",
    "body": "Fill in the shift chart, send one line from the script pack, and there is a named, written shift by bedtime.",
    "cta_label": "Get Every Night, Just Me",
    "trust_line": "Educational content - not medical, clinical, or mental-health advice. This coordinates night-care between adults; it never diagnoses or treats any condition and never replaces professional care.",
    "evidence_label": "Educational content informed by relationship research, postpartum guidance, and lived experience. It is not a substitute for medical, clinical, or mental-health assessment."
  },
  "next": {
    "label": "Where this leads",
    "headline": "The next situations",
    "intro": "Night division is one node on a journey.",
    "note": "These are next situations in the library; their canonical records are being rebuilt.",
    "items": [
      {
        "title": "The daytime division of labour",
        "reason": "The daytime counterpart to the night roster.",
        "code": "V09",
        "product_id": ""
      },
      {
        "title": "Reconnection once sleep stabilises",
        "reason": "The emotional distance that surfaces when the nights calm down.",
        "code": "V11",
        "product_id": ""
      },
      {
        "title": "Returning to work",
        "reason": "Nights and pumping schedules must interlock when leave ends.",
        "code": "V19",
        "product_id": ""
      }
    ]
  }
}
